"回答日時","受付番号","回答ユーザ","第３回:キーワード①","第３回:キーワード②","第３回:キーワード③","第３回:キーワード④","第３回:キーワード⑤"
"2022/04/28 18:57","5232","22021291","やり切る","一貫することの大切さ","やると決めたら楽しむ","嫌だと思わない","出会いの大切さ"
"2022/04/28 18:57","5231","31021052","弁護士は裁判に行く人の イメージで私も抱いていたのですが 会議が多いと聞いて驚きました。","裁判で1番労力作るのは書面作りで1人で やることが多いと聞いて大変だと感じました。","テレビで見てるような言い合いを法廷するのは年に数回程度ときいて、ドラマと現実は 全然違うことを知ることができました。","カセットテープを聴き始めたのは引っ越しするために処分しないといけないためだったが それが法律を面白いと思うきっかけとなった ので人生において何がきっかけでやりたいことを見つけるかはタイミングだと思いました。","やると決めたら楽しむとおっしゃっていて その考え方は大事だと感じました。面白くないと思うとやりたくなくなりますが、楽しもうと思うと変わってくると思います。"
"2022/04/28 18:57","5230","29020471","やると決めたら楽しむ。","自分に満足せず、伸びしろがあると考える。","否定的に感じることがあっても、来た波にはのる。","努力しないと何も得られないから全て全力で挑む。","聞かれるよりも前に自分から行動する。"
"2022/04/28 18:57","5229","23020424","やると決めたら楽しむ","主体性","のびしろ","来た波に乗る","真剣勝負"
"2022/04/28 18:57","5228","24022156","困難なことでもやるときは楽しむ。","同志の存在は自分のパフォーマンスに良い影響を与える。","若いうちから自分で考えて行動することが大切。","否定的なイメージがあることにも挑戦してみる。","仕事の基本は誠意をもって取り組むこと。"
"2022/04/28 18:57","5227","24021094","自分の好きなことは熱心に取り組む","周りに流されることなく、やると決めたことは楽しむ","ものごとに行き詰まったときは第三者の目で俯瞰してみる","現状に満足せず、伸びしろを伸ばし続ける","思い切って波に乗って自信をつける"
"2022/04/28 18:55","5225","22021297","俯瞰的な視点","すると決めたら楽しむ","来た波には乗る","全て真剣勝負","横の繋がり"
"2022/04/28 18:55","5224","38022047","やると決めたら楽しむ","経験が大切","ポジティブな考え方をする","自分で考えて自分で行動する","自分が努力しない限り得られるものはない"
"2022/04/28 18:54","5223","29022518","嫌々やっても良い結果は生まれないのでやる時は楽しむ","ひとつの成功体験が自分の自信につながる","自分を信頼してくれた人の頼みは断らない","新しいものや情報は生まれ続けるので常に勉強する","実績→信頼→自信のサイクルを作る"
"2022/04/28 18:54","5221","22021462","やると決めたら楽しむ","自分で考えて自分で行動する","波が来たら全力で乗る","実績から信頼を得ると自信に繋がる","やりきる力"
"2022/04/28 18:54","5220","37022268","法律楽しい","今の学生はやることが明白","将来を見据えてお客様にとって何がいいか考えるのが弁護士","新しい仕組みに追いつくのが大変","聞かれる前に連絡をする"
"2022/04/28 18:53","5219","24021034","やると決めたら楽しむ","仕事は第三者の視点で俯瞰的に見る必要がある","常に向上心を持つ","自分が努力しないと何も得られない","舞い込んできた仕事は取り敢えず全力で取り組む"
"2022/04/28 18:53","5218","26021139","やると決めたら楽しむ精神","ボス","他者の利益のために活用できる方法","関西学院大学の非常勤講師","情報"
"2022/04/28 18:53","5217","24021361","実務と司法はことなる","やるからには楽しくやる","第三者の意見を聞く","今ある仕組みをどう利用し自分のものにするか","来たものにはのる"
"2022/04/28 18:52","5216","29022050","やると決めたら楽しむ","波がきたら乗り、そこで自信をつける","大学で司法試験へ向けて勉強する仲間を見つけた","自分で考えて自分で行動する","弁護士になるためには新しい法律などを学び続けられる力が必要"
"2022/04/28 18:51","5215","22020140","やると決めたら楽しむ","自分で考えて自分で行動する","必死に打ち込む","人の役に立つ","他者の利益"
"2022/04/28 18:51","5214","23020081","やると決めたら楽しむ。","自分はちっぽけであると思うようになる＝大人の始まり。","自分で考えて、自分で行動することが重要。","波がきたらのるべき。","実績をあげ、周囲の信頼を得ることによって自信が生まれる。また、これが実績に繋がる。"
"2022/04/28 18:51","5213","37021457","楽しむ","全体を俯瞰する","決断の連続","実績","信頼"
"2022/04/28 18:51","5212","22022622","やると決めたら楽しむ","自分で考えて自分で行動する力","実績→信頼→自信というキャリアの正のスパイラル","好奇心をもって自ら体験する","社会に出たら人との出会いが自分の助けになる"
"2022/04/28 18:50","5211","22020703","学生時代はやりたいことに集中","やると決めたら楽しむ","仕事をするうちに自分のしたいことが見つかる","目の前の仕事を真剣にする","実績を上げることは、周囲の信頼や自信につながる"
"2022/04/28 18:50","5210","26022527","自分がやると決めたならそれを楽しむ","自分の興味を仕事にする努力","ひたすら目の前のことに取り組み経験を積み重ねていく大切さ","チャンスをもらったからには断らずにチャレンジすること","努力をしないかぎり得られることは無い"
"2022/04/28 18:50","5208","24020237","目の前にあることを精一杯やるが大切","来た波にはとりあえず乗ってみることが大切","来た波に対して実績として返すことで、信頼を得ることができ、それが自信につながる","何事も最後まで諦めずにやりきる","過去の出来なかった経験を活かして未来への挑戦に繋げる"
"2022/04/28 18:49","5207","22021689","やるとや決めたら楽しむ","最初から怖がらない","来た波に乗る","責任の重さを知った上で、全力で頑張る","信頼、自信、実績"
"2022/04/28 18:49","5206","31021343","知らないことの方がやる気が出る","マスタリーフォーサービス","学生時代に留学に行くべき","何事にも好奇心を持って行動。勉強にも。","やると決めたらとことん楽しむ"
"2022/04/28 18:49","5205","29021052","やると決めたら楽しむことが重要","とりあえず、きた波に乗ることが重要","どんな仕事に対しても真剣勝負で挑む","常に勉強する、学ぶ姿勢が大事","自信は実績を上げ、周囲から信頼を得ることからできる"
"2022/04/28 18:49","5204","25022313","やると決めたら楽しむ","自分で考えて行動する機会がいい経験になる","一つ一つの仕事が真剣勝負","実績→信頼→自信の正のサイクル","人との繋がりを大切にする"
"2022/04/28 18:48","5203","29020257","やると決めたら楽しむ","新しい仕組みについて行く難しさ","来た波に乗る、そして真剣に考える","努力をしなければお金は降ってこない","聞かれる前に連絡(信頼関係を保つ)"
"2022/04/28 18:48","5202","22021612","やると決めたら楽しむ","自分を俯瞰的に見る視点が大切","人との出会い、縁を大切にする","自分の背景には繋がりがある","自ら体験して経験にする"
"2022/04/28 18:48","5201","26020561","あることをすると決定した時は、それを楽しんで行う。","熱中することは大切であるが、その時の自分を俯瞰的に見ることもまた大事である","弁護士という職業は人の役に立つことができるものである","社会に身を置く際に周りの人との出会いが自分を助けることになる。","自分が勉強したことがないものを勉強したかった"
"2022/04/28 18:47","5200","29022176","やると決めたら楽しむ","俯瞰してみる","来た波に乗る","全ての仕事が真剣勝負","必死"
"2022/04/28 18:47","5199","23020231","1度やると決めたら楽しむ。","嫌だと思って取り組んでも長続きしない。負け試合をなんとか引き分けに持ち込むくらいの熱意が大切","第三者的な視点で物事をとらえる。","色んなことをネットで調べられる時代ではあるが、好奇心を持って色々な現場で自ら体験することが大事。","自分の存在をちっぽけだと感じることは大人への第1歩である。"
"2022/04/28 18:47","5198","34022255","やると決めたら楽しむ","自分で考えて行動する","新しい事に挑戦してみる","信頼を得られると自信に繋がる","色んなことをやりきる力"
"2022/04/28 18:46","5197","22021349","自分が楽しいと思える(ハマる)勉強をする","やると決めたら楽しむことが大事","自分がちっぽけなものだと思うことが大人になるための一歩","自分で考えて自分で行動することが大切(それが可能になる環境も大切)","好奇心を持っていろんな現場に足を運んで自ら経験する"
"2022/04/28 18:46","5196","24021735","やると決めたら最後まで楽しむこと","目指す夢は大学入学後に変わっても何ら問題ない","人生においての波を見極めて、波に乗る","実績→信頼→自信という正のスパイラルを作ることが大切","自分のキャリアに自信をもつ、自信をもつことが自分の成長に繋がる"
"2022/04/28 18:45","5194","29021513","やると決めたら楽しむ","波がきたら乗る","誠心誠意実績という形で返さなければならない","信頼を得られると自信をつけると実績に繋がる","好奇心をもって色んな現場に足を運んで自らで体験して経験する"
"2022/04/28 18:45","5193","23020307","専門分野とは自分の好きなものを宣言するということだ","やると決めたら楽しむ","第三者的な視点を持つ","来た波に乗る","Mastery for Serviceのように自分の知識を他者の利益のために使う"
"2022/04/28 18:44","5192","25019436","頭の中にある物を吐き出す","仕事をしている中でやりたい事が出てくる","他者の利益のために自分の知識を使う","全ての出発点","好奇心を持って色んな現場に足を運ぶ"
"2022/04/28 18:43","5191","22020126","自分で考えて自分で動く","経験によって自信がつく","自分がちっぽけだと思うことが大人の始まり","努力しない限り得られるものはない","やると決めたら楽しむ"
"2022/04/28 18:43","5190","22020386","知らなければ怖いものはない","やると決めたら楽しむ","企業で人を育てる","第三者的な視点を持つことが大切","人の役に立ったと感じる嬉しさ"
"2022/04/28 18:42","5189","27020265","自分で考え行動する","波が来たら乗る","実績信頼で自信がつく","やると決めたら楽しむ","好奇心を持って経験する"
"2022/04/28 18:42","5188","38021027","自分がちっぽけと感じられるのが大人の始まり","初めから自分を知ってもらう","来た波に乗る","実績-信頼-自信のスパイラル","やると決めたら楽しむ"
"2022/04/28 18:42","5187","22022813","勉強を苦だと捉えない","やると決めたら楽しむ","客観的視点","ポジティブシンキング","決断力の重要性"
"2022/04/28 18:41","5186","25021478","司法試験で身につけた知識と実務で必要な知識はちがう。","常に新しい法律問題が出てくるため、弁護士はずっと勉強し続ける仕事。","弁護士の立場は第三者目線でなければ意味がない。物事を俯瞰してクライアントの将来を考えることが役割。","来た波には乗る。乗ったら必死に努力する。","やると決めたら楽しむ"
"2022/04/28 18:41","5185","25020678","接続詞にまで気を使い、仕事をする","やると決めたら楽しむことが大切","しっかり波に乗る","決断をするときに情報をもっと集める","自信をつける"
"2022/04/28 18:40","5184","24020704","やると決めたら楽しむことが大切","自分で考えて自分で行動することが大切","第三者的視点を持つ必要がある","すべての事に対して聞かれる前に行動する","努力して実績を積むことで自信が付き成長につながる"
"2022/04/28 18:39","5183","22020430","裁判にいくというより、会議をしたり、書面作成がメイン","世の中の全てのことが法律(契約)で成り立っている","やると決めたら楽しむ","弁護士の仕事は第三者的に物事を見ること","法律問題は決断の連続"
"2022/04/28 18:38","5182","37021027","やると決めたら楽しむ","全体をみる","自分がちっぽけだなと感じる","様々なことに好奇心をもつ","自ら色々な経験をする"
"2022/04/28 18:38","5181","27020295","説得力がないと不安に感じられる","助け合い","クレーム対応が大変","決断の連続","好奇心をもって経験を積むことが重要"
"2022/04/28 18:38","5180","25020351","やると決めたら楽しむ","物事を俯瞰的に見る","傾聴","消去法","人の役に立てることを実感する"
"2022/04/28 18:37","5178","36021030","色々なバイトをする","資格を取った方が良い","とりあえずやってみる","第三者の立場で依頼人と接することが重要","好奇心をもつ"
"2022/04/28 18:37","5177","22020425","やるからには楽しむ姿勢","早い段階で法廷へ出向くなど、普通より早い段階で経験することが大事","弁護士は第三者的に全力を尽くす、来談者目線ではなく俯瞰的に見る姿勢が大事","署名によって裁判所の言い分が大きく変わることがある","来た波には想像しすぎない程度に乗る事で様々なきっかけを掴む"
"2022/04/28 18:37","5176","37022231","自分のことをちっぽけな存在だと思うことが、大人の始まりであること","最後の最後まで考えずにとりあえず波に乗ってみることも大切","実績をあげることで信頼を得てそこから自信が生まれるということ","自らが足を運んで実際に経験することが大切","自分の考え方に一貫性を持つことが大切"
"2022/04/28 18:37","5175","29021427","やると決めたら楽しむ","自分で考えて自分で行動する","一つ一つの仕事を一生懸命にする","実績を上げて信頼を得て自信を得る","他者の利益のために自分の知識を活用する"
"2022/04/28 18:36","5174","31020324","やると決めたとこはとことん楽しむ","周りに比べて自分がちっぽけな存在に感じても、それが大人の始まりである","自分で考えて自分で行動するということが活躍へと繋がる","波をつくっている人に返すために、来た波には乗る","実績を上げることで信頼を得、それにより自信が身につく。そしてこれらは循環する。"
"2022/04/28 18:36","5173","25020397","経験を積むために準備をしっかりする","やると決めたら楽しむ","分からないことは聞く","1つのことから派生できる頭を持つ","来た波には乗り、実績を残す"
"2022/04/28 18:36","5172","38022010","やると決めたら楽しむ","過去の失敗をいかす","今の自分に満足しない","努力して成果をつかむ","何事も前向きに行動する"
"2022/04/28 18:36","5171","23022544","やると決めたら楽しむ","第三者的な視点を持つ","アルバイトなどで様々な経験をする","来た波には乗る","勉強を楽しむ"
"2022/04/28 18:35","5170","39022115","やると決めたら楽しむ","第三者の立場から考える","やりたいことを見つける","来た波に乗る","一つ一つのことを真剣にする"
"2022/04/28 18:35","5169","27020513","事をはっきり決めなくてもやりたいこと楽しいことをする","勉強では分からないところを潰していく全てを知る","自分をちっぽけだと思ったところが大人の始まり","来た波に対して誠心誠意で返すことが大事","信頼を得て自信につながるキャリアの正のスパイラル"
"2022/04/28 18:34","5168","24022332","「やると決めたら楽しむ」","昔、司法試験合格後の研修は2年間だった。","研修卒業試験に合格すると、裁判官・検察官・弁護士のどれかになるための登録を行う。","検察官との研修中、実際の取り調べに参加する。","裁判官になるためには、司法試験・研修にて上位の成績を保持する必要がある。"
"2022/04/28 18:34","5167","29021355","俯瞰的な視点","楽しむと決める","知らない分野への好奇心","真剣に努力して得られるもの","新しいことへの挑戦"
"2022/04/28 18:34","5166","31022114","やると決めたら楽しむ","自分で考えて自分で行動する","第三者的な視点をもつ","人の感情を理解する","好奇心を持ち、実際足を運ぶ"
"2022/04/28 18:33","5165","29022168","好きなことを宣言することで仕事が振り込んでくる","やると決めたら楽しむ","周りに振り回されない","相手が自分のために提案してくれてるものは一旦試してみる","波に乗ったからには精一杯取り組む"
"2022/04/28 18:33","5164","26021294","やると決めたら楽しむ","来た波に乗る","実績、信頼、自信の生のスパイラル","他者の利益のため","好奇心を持って体験を通して経験を積む事を大切に"
"2022/04/28 18:33","5163","26022257","やると決めたら楽しむと決める","若いうちから自分で考えて自分で行動しておくとよい","専門分野とは自分の好きなものを宣言することだ","来た波には乗る","聞かれる前に連絡する"
"2022/04/28 18:32","5162","34020059","受験勉強はわからないところをつぶしていく","若いころは説得力がないためどうしても不安に思われてしまう","なんでできないのかと悩む頃が大人の始まり","波に乗ってみることも大事","G号館はもともと野球部のグラウンドだった！！"
"2022/04/28 18:32","5161","29020060","知らないと怖いものはない","周りに焦ることはなかった","やると決めたら楽しむ","楽しむと決める","ギャップ"
"2022/04/28 18:31","5160","22020376","専門分野は得意なものの宣言","やると決めたら楽しむ","第三者","傾聴","来た波に乗る"
"2022/04/28 18:30","5159","24020034","やると決めたら楽しむこと。","自分で考えて、自分で行動することが今後の自分に繋がるということ。","迷ったらとりあえずやるということ。","波が来たら乗ること。","波を作ってくれている人に対して誠心誠意返すことで信頼を得るということ。"
"2022/04/28 18:28","5158","29021416","マイペース","きっかけは突然やってくる","一つ一つの仕事に真剣勝負","法律のカセットテープ","人との出会いが自分を助けてくれる"
"2022/04/28 18:28","5157","31020353","やると決めたら楽しむ","自分がちっぽけな存在だと分かったら大人","活躍のために、自分で考えて自分で行動する","波が来たら乗る","実績を上げることで信頼を得て、自信へとつながる"
"2022/04/28 18:28","5156","22020124","自分の興味を優先","やると決めたら楽しむ","自分をちっぽけだと思う成長","上司と周りの環境","実績、信頼、自信が繋がっている"
"2022/04/28 18:27","5155","22021168","来た波に乗る","人と人との繋がりを大切に","やると決めたら楽しんでする","好奇心を持って多くのことを経験する","他人の利益のためにできることを見つける"
"2022/04/28 18:27","5154","22020163","やると決めたら楽しむ","留学","自ら体験","人との出会いを大切に","全ての経験に価値がある"
"2022/04/28 18:27","5153","29021297","司法試験で支え合う仲間の存在から、仲間は大切である","何事にも全体的に、俯瞰的に見る視点が大切","目の前のやるべきことに対して必死になって打ち込み、それを楽しむ","実績を上げて信頼を得て、信頼を得ることで自信をもつというキャリアの正のスパイラル","好奇心をもち、自分で興味を持って自分で行動して経験する"
"2022/04/28 18:26","5151","22021098","やると決めたら楽しむ","自分で考えて行動する","来た波に乗る","努力しない限り得られるものは無い","現場に足を運ぶ"
"2022/04/28 18:26","5150","37021405","やると決めたら楽しむ","第三者の視点を持つ","成功体験を経て自信をつける","来た波にはのる","好奇心をもって体験することにチャレンジする"
"2022/04/28 18:25","5149","39022034","やると決めたら一生懸命やる","成功体験","自分で考えて自分で行動","お金は降ってこない","実績→信頼→自信"
"2022/04/28 18:24","5148","31022530","企業が人を育てる","自分で考えて行動する","やると決めたらポジティブに！","他人の意見に耳を傾ける","一つ一つの仕事に真剣勝負"
"2022/04/28 18:23","5146","25022591","嫌だと思ったらできない","できないという経験が活かせる","きた波に乗る","努力しない限り得られるものはない","前向きに考えないとしんどくなる"
"2022/04/28 18:23","5145","23021108","小島法律事務所弁護士","第三者","委任状","好奇心","人生が関学から始まった"
"2022/04/28 18:22","5144","26020450","やると決めたら楽しむ","大変なことでも逃げない","俯瞰的に物事を見る","自分がちっぽけに見えた時が大人の始まり","来た波には乗る"
"2022/04/28 18:22","5143","24021783","勉強と実務は違う","自分を小さい人だと思う","責任が伴うときは時間をかける","勉強は楽しい","自分で考えて行動する"
"2022/04/28 18:22","5142","26020571","専門分野とは自分が好きなものを宣言するということである。","やると決めたら楽しむ","弁護士の役割は第三者の目線を持つ必要がある","自分で考えて自分で行動する","努力して一つ一つ真剣に向き合う"
"2022/04/28 18:21","5141","27020077","やると決めたら楽しむ","仲間の繋がりを大切に","なんでも挑戦する","第三者的な目線をもつ","来た波には乗る"
"2022/04/28 18:20","5140","26020674","自分が聞いててつまらないと思う授業はしない","しんどい時こそ楽しく生活する","ポジティブは仕事において大切","生活環境の変化によって仕事のスタイルが変わる","何事にもチャレンジし波に乗ることが大切"
"2022/04/28 18:20","5139","23020036","挑戦するなら何事も楽しむ。","新人であっても自分で考えて自分で行動する。","できないという挫折の経験を活かす。","他者の利益のために自分の知識を使う。","色々な経験を積むことで価値を見つけていく。"
"2022/04/28 18:20","5138","22021609","周りに振り回されてはいけない","やると決めたならば全力で楽しむ","人(仲間)との出会いが己を助ける","背景には人の繋がりがある","好奇心を持ち行動する"
"2022/04/28 18:19","5137","32021399","やると決めたら楽しむ","楽しむは自分の意志で決めるもの","波が来たらとりあえず乗ってみる、誠心誠意","仕事一つ一つが真剣勝負","弁護士は社会奉仕を実感できる仕事"
"2022/04/28 18:19","5136","26022045","専門分野で自分が好きなものを宣言することで仕事が自然と集まってくる","やると決めたら楽しむ","同じ目標のに向かって支え合える仲間を見つける","厳しくても自分で考えて行動できる場所に身を置く","寄り添うのではなく第三者的な視点から見ることが大切"
"2022/04/28 18:19","5135","26022440","法律は日々変わっていくことが多い世界","来た波には乗る","知らないことの方が興味深い","予測される前に動く","常に学び続けること"
"2022/04/28 18:18","5134","24020750","アルバイトと法務の関係","俯瞰的な観点を持つこと","説明力と決断力","新しい法律問題","人の役に立てる仕事"
